{
  "schemaVersion": "1.3",
  "reviewedAt": "2026-08-14",
  "catalogCompleteness": "ExpandedReviewedExactSkuClientCatalogThroughRyzenAi400AndRyzenAiMaxPro400WithNegativeControls",
  "unknownSkuPolicy": "ReviewRequired",
  "normalization": "Case-insensitive regex over Windows processor name; decorative trademark markers and Radeon Graphics suffixes may be present. Entries are exact reviewed SKUs; no series-name-only NPU inference is permitted.",
  "sources": [
    {
      "id": "amd-7040-consumer-launch",
      "type": "PublishedExactSkuTable",
      "url": "https://www.amd.com/en/newsroom/press-releases/2023-1-4-amd-extends-its-leadership-with-the-introduction-o.html",
      "statement": "AMD launch material lists exact Ryzen 7040HS models; reviewed together with Ryzen AI exact supported-configuration documentation for Phoenix NPU capability."
    },
    {
      "id": "amd-7040-pro-launch",
      "type": "PublishedExactSkuTable",
      "url": "https://www.amd.com/en/newsroom/press-releases/2023-6-13-amd-expands-world-class-commercial-portfolio-with-.html",
      "statement": "AMD exact Ryzen PRO 7040 table marks 7940HS, 7840HS, 7640HS, 7840U and 7640U Ryzen AI Engine Included, and 7540U without Ryzen AI."
    },
    {
      "id": "amd-rai12-exact-phx-hpt",
      "type": "PublishedExactSupportedConfiguration",
      "url": "https://ryzenai.docs.amd.com/en/1.2/inst.html",
      "statement": "AMD Ryzen AI Software 1.2 directly maps exact Phoenix and Hawk Point SKU names to PHX/HPT supported configurations."
    },
    {
      "id": "amd-8040-consumer-launch",
      "type": "PublishedExactSkuTable",
      "url": "https://www.amd.com/en/newsroom/press-releases/2023-12-6-amd-extends-mobile-pc-leadership-with-amd-ryzen-8.html",
      "statement": "AMD exact Ryzen 8040 table marks 8945HS, 8845HS, 8840HS, 8840U, 8645HS, 8640HS and 8640U NPU Yes; 8540U and 8440U NPU NA."
    },
    {
      "id": "amd-8040-pro-launch",
      "type": "PublishedExactSkuTable",
      "url": "https://www.amd.com/en/newsroom/press-releases/2024-4-16-amd-expands-commercial-ai-pc-portfolio-to-deliver-.html",
      "statement": "AMD exact Ryzen PRO 8040 and PRO 8000 desktop tables publish Ryzen AI availability per exact SKU."
    },
    {
      "id": "amd-8000g-consumer-launch",
      "type": "PublishedExactSkuTable",
      "url": "https://www.amd.com/en/newsroom/press-releases/2024-1-8-amd-reveals-next-gen-desktop-processors-for-extrem.html",
      "statement": "AMD Ryzen 8000G launch identifies 8700G and 8600G as Ryzen AI capable and 8500G/8300G as N/A."
    },
    {
      "id": "amd-ryzen-ai-compatibility-current",
      "type": "PublishedCompatibilityTable",
      "url": "https://www.amd.com/en/products/processors/laptop/ryzen.html",
      "statement": "AMD current Ryzen processor page states Ryzen AI compatibility exclusions for 7040/8040 and 8000G families."
    },
    {
      "id": "amd-ryzen200-ces2025",
      "type": "PublishedExactSkuTable",
      "url": "https://www.amd.com/en/newsroom/press-releases/2025-1-6-amd-announces-expanded-consumer-and-commercial-ai-.html",
      "statement": "AMD CES 2025 exact Ryzen 200/PRO 200 table publishes NPU TOPS or N/A per exact SKU."
    },
    {
      "id": "amd-ai300-launch",
      "type": "PublishedExactSkuTable",
      "url": "https://www.amd.com/en/newsroom/press-releases/2024-6-2-amd-unveils-next-gen-zen-5-ryzen-processors-to-p.html",
      "statement": "AMD launch material publishes Ryzen AI 9 HX 370 and Ryzen AI 9 365 with XDNA 2 NPU capability."
    },
    {
      "id": "amd-ai300-ces2025",
      "type": "PublishedExactSkuTable",
      "url": "https://www.amd.com/en/newsroom/press-releases/2025-1-6-amd-announces-expanded-consumer-and-commercial-ai-.html",
      "statement": "AMD CES 2025 exact table publishes Ryzen AI 7 350, AI 5 340, AI 7 PRO 350 and AI 5 PRO 340 with 50 NPU TOPS."
    },
    {
      "id": "amd-ai-pro300-launch",
      "type": "PublishedExactSkuTable",
      "url": "https://www.amd.com/en/newsroom/press-releases/2024-10-10-amd-launches-new-ryzen-ai-pro-300-series-processo.html",
      "statement": "AMD exact Ryzen AI PRO 300 launch table publishes HX PRO 375, HX PRO 370 and AI 7 PRO 360 with 55/50 TOPS."
    },
    {
      "id": "amd-ai9hx375",
      "type": "PublishedExactProduct",
      "url": "https://www.amd.com/en/products/processors/laptop/ryzen/ai-300-series/amd-ryzen-ai-9-hx-375.html",
      "statement": "AMD exact product page publishes Ryzen AI 9 HX 375 NPU capability."
    },
    {
      "id": "amd-ai7-345",
      "type": "PublishedExactProduct",
      "url": "https://www.amd.com/en/products/processors/laptop/ryzen/ai-300-series/amd-ryzen-ai-7-345.html",
      "statement": "AMD exact product page publishes Ryzen AI 7 345 NPU capability."
    },
    {
      "id": "amd-ai5-330",
      "type": "PublishedExactProduct",
      "url": "https://www.amd.com/en/products/processors/laptop/ryzen/ai-300-series/amd-ryzen-ai-5-330.html",
      "statement": "AMD exact product page publishes Ryzen AI 5 330 NPU capability."
    },
    {
      "id": "amd-ai-max300-ces2025",
      "type": "PublishedExactSkuTable",
      "url": "https://www.amd.com/en/newsroom/press-releases/2025-1-6-amd-announces-expanded-consumer-and-commercial-ai-.html",
      "statement": "AMD exact Ryzen AI Max 300 and Max PRO 300 table publishes NPU TOPS per SKU."
    },
    {
      "id": "amd-ai400-ces2026",
      "type": "PublishedExactSkuTable",
      "url": "https://www.amd.com/en/newsroom/press-releases/2026-1-5-amd-expands-ai-leadership-across-client-graphics-.html",
      "statement": "AMD CES 2026 exact Ryzen AI 400/PRO 400 mobile table publishes 50-60 NPU TOPS per SKU and adds AI Max+ 392/388."
    },
    {
      "id": "amd-ai400-desktop-mwc2026",
      "type": "PublishedExactSkuTable",
      "url": "https://www.amd.com/en/newsroom/press-releases/2026-3-2-amd-gives-consumers-and-businesses-more-ai-pc-opti.html",
      "statement": "AMD MWC 2026 exact Ryzen AI 400/PRO 400 desktop table publishes up to 50 NPU TOPS for G/GE SKUs."
    },
    {
      "id": "amd-ai-max-pro400-blog",
      "type": "PublishedExactSkuTable",
      "url": "https://www.amd.com/en/blogs/2026/amd-powers-next-generation-agent-computers-with-new-ryzen-ai-hal.html",
      "statement": "AMD publishes Ryzen AI Max+ PRO 495, Max PRO 490 and Max PRO 485 with XDNA 2 NPU and 55/50 TOPS."
    },
    {
      "id": "amd-rai18-production-driver",
      "type": "PublishedDriverFamilySupport",
      "url": "https://ryzenai.docs.amd.com/en/latest/inst.html",
      "statement": "Ryzen AI Software 1.8 publishes driver 32.0.203.376 for Phoenix, Hawk Point, Strix, Strix Halo and Krackan Point; Gorgon Point/Halo are not in that published family list."
    },
    {
      "id": "amd-z-series",
      "url": "https://www.amd.com/en/products/processors/handhelds/ryzen-z-series.html"
    },
    {
      "id": "amd-ai-z2-extreme",
      "url": "https://www.amd.com/en/products/processors/handhelds/ryzen-z-series/z2-series/ai-z2-extreme.html"
    },
    {
      "id": "amd-z2-extreme",
      "url": "https://www.amd.com/en/products/processors/handhelds/ryzen-z-series/z2-series/z2-extreme.html"
    },
    {
      "id": "amd-z2",
      "url": "https://www.amd.com/en/products/processors/handhelds/ryzen-z-series/z2-series/z2.html"
    },
    {
      "id": "amd-z2-go",
      "url": "https://www.amd.com/en/products/processors/handhelds/ryzen-z-series/z2-series/z2-go.html"
    },
    {
      "id": "amd-z2-a",
      "url": "https://www.amd.com/en/products/processors/handhelds/ryzen-z-series/z2-series/z2-a.html"
    },
    {
      "id": "amd-z1-extreme",
      "url": "https://www.amd.com/en/products/processors/handhelds/ryzen-z-series/z1-series/z1-extreme.html"
    },
    {
      "id": "amd-z1",
      "url": "https://www.amd.com/en/products/processors/handhelds/ryzen-z-series/z1-series/z1.html"
    },
    {
      "id": "observed-z2-runtime-20260813",
      "type": "ObservedRuntimeReviewed",
      "evidenceArchiveSha256": "f10c70ef8a6d1621f36bd1e0ce1e91b915af3a684e7754cff26fb99308d4258e",
      "statement": "Observed Ryzen AI Z2 Extreme runtime binds exact SKU to DEV_17F0 REV_10 / NPU Strix / AMD 376 exact runtime stack."
    }
  ],
  "processors": [
    {
      "processorId": "ryzen-9-7940hs",
      "canonicalName": "AMD Ryzen 9 7940HS",
      "matchRegex": "AMD\\s+Ryzen(?:\\(TM\\)|™)?\\s+9\\s+7940HS\\b",
      "series": "Ryzen 7000 Series",
      "codename": "Phoenix",
      "npuIdentityId": "amd-npu-aie2-1502",
      "expectedDeviceIds": [
        "1502"
      ],
      "npuTops": 10,
      "sourceIds": [
        "amd-7040-consumer-launch",
        "amd-rai12-exact-phx-hpt"
      ],
      "npuAvailability": "AvailablePublished",
      "npuEvidence": "AmdExactSkuTablePlusReviewedFamilyIdentity",
      "productIdTray": null
    },
    {
      "processorId": "ryzen-7-7840hs",
      "canonicalName": "AMD Ryzen 7 7840HS",
      "matchRegex": "AMD\\s+Ryzen(?:\\(TM\\)|™)?\\s+7\\s+7840HS\\b",
      "series": "Ryzen 7000 Series",
      "codename": "Phoenix",
      "npuIdentityId": "amd-npu-aie2-1502",
      "expectedDeviceIds": [
        "1502"
      ],
      "npuTops": 10,
      "sourceIds": [
        "amd-7040-consumer-launch",
        "amd-rai12-exact-phx-hpt"
      ],
      "npuAvailability": "AvailablePublished",
      "npuEvidence": "AmdExactSkuTablePlusReviewedFamilyIdentity",
      "productIdTray": null
    },
    {
      "processorId": "ryzen-5-7640hs",
      "canonicalName": "AMD Ryzen 5 7640HS",
      "matchRegex": "AMD\\s+Ryzen(?:\\(TM\\)|™)?\\s+5\\s+7640HS\\b",
      "series": "Ryzen 7000 Series",
      "codename": "Phoenix",
      "npuIdentityId": "amd-npu-aie2-1502",
      "expectedDeviceIds": [
        "1502"
      ],
      "npuTops": 10,
      "sourceIds": [
        "amd-7040-consumer-launch",
        "amd-rai12-exact-phx-hpt"
      ],
      "npuAvailability": "AvailablePublished",
      "npuEvidence": "AmdExactSkuTablePlusReviewedFamilyIdentity",